{"schema":"aria.intent-verification-bundle/0.9","intent":{"schema":"aria.intent/0.9","name":"AuthorizePerCardExecutionEvidenceAlpha10","objective":"Bind every verified sequence-card exercise to bounded, tamper-evident, privacy-preserving execution evidence without expanding ARIA authority.","assumptions":["alpha.9 is the clean remotely attested baseline","the explicit user instruction Do it approves this bounded evolution"],"requiredOutcomes":[{"id":"ambiguity.resolved","expected":true},{"id":"authority.ceiling.declared","expected":true},{"id":"evidence.observational","expected":true},{"id":"scope.locked","expected":true}],"forbiddenOutcomes":["capability.expand","history.rewrite","policy.expand","runtime.value.disclose","secret.read","unrelated.source.change"],"allowedEffects":["console.emit","network.send","repository.write"],"acceptanceCriteria":[{"id":"architecture-decision","evidenceKind":"design-record"},{"id":"aria-plan-gate","evidenceKind":"aria-gate"},{"id":"dedicated-evidence-lattice","evidenceKind":"test-lattice"}],"ambiguities":[{"id":"test-receipt-semantics","question":"Does the runtime receipt claim the complete repository suite ran for this execution, or identify the card admission test contract?","severity":"material"},{"id":"timestamp-determinism","question":"Must wall-clock timestamps repeat across executions, or be exactly bound observations inside deterministic receipt canonicalization?","severity":"material"}],"requireIndependentChallenge":true,"id":"sha256:fc5d77ae36b7942698b3aa285aedee57d301fb09ca9213d29b11b99dfea47eeb"},"interpretation":{"schema":"aria.intent-interpretation/0.9","intentId":"sha256:fc5d77ae36b7942698b3aa285aedee57d301fb09ca9213d29b11b99dfea47eeb","interpreter":"agent:codex-producer","understoodObjective":"Derive one independently verifiable receipt from each verified Map, Filter, or Reduce terminal event, join exact program and governance identities, preserve privacy, and keep evidence observational.","assumptions":["alpha.9 is the clean remotely attested baseline","the explicit user instruction Do it approves this bounded evolution"],"expectedEffects":["console.emit","network.send","repository.write"],"claimedObligations":["ambiguity.resolved","architecture-decision","aria-plan-gate","authority.ceiling.declared","dedicated-evidence-lattice","evidence.observational","scope.locked"],"unresolvedAmbiguities":["test-receipt-semantics","timestamp-determinism"],"implementationRef":"sha256:157e6b82d8bbf50e4930a758a7186db388f82850b6b6eb5a5b4b3b70d8febf95","id":"sha256:ad09569cfea80f48e94f46fc259d85c3940c8ca8cad1aad7c77419534b28ace3"},"approval":{"schema":"aria.intent-approval/0.9","intentId":"sha256:fc5d77ae36b7942698b3aa285aedee57d301fb09ca9213d29b11b99dfea47eeb","interpretationId":"sha256:ad09569cfea80f48e94f46fc259d85c3940c8ca8cad1aad7c77419534b28ace3","approver":"human:jackson","decision":"approved","decidedAt":"2026-07-27T16:00:00.0000000Z","ambiguityResolutions":[{"id":"test-receipt-semantics","resolution":"Bind the canonical card admission test contract only; document that current release and CI health are separate closure evidence."},{"id":"timestamp-determinism","resolution":"Treat wall-clock time as an exact observation; deterministic identity means identical evidence inputs canonicalize identically, not that separate runs share a timestamp."}],"challengeResolutions":[{"id":"authority-confusion","resolution":"Encode observational class, grantsAuthority false, and an empty capability list; reject any drift."},{"id":"self-reported-evidence","resolution":"Derive outcome from the verified terminal Event Spine state, derive identities from the decoded container and policy bytes, and expose only aggregate counts plus an allowlisted SignalSubset."}],"nonce":"per-card-execution-evidence-alpha10-user-do-it","id":"sha256:2a7971f626b09127faec14e32864ff55b65e230d2010343c9bf062ee2b3a03a6"},"challenges":[{"schema":"aria.intent-challenge/0.9","intentId":"sha256:fc5d77ae36b7942698b3aa285aedee57d301fb09ca9213d29b11b99dfea47eeb","interpretationId":"sha256:ad09569cfea80f48e94f46fc259d85c3940c8ca8cad1aad7c77419534b28ace3","challenger":"agent:aria-critic","issues":[{"id":"authority-confusion","severity":"material","message":"A sealed execution receipt could be misread as permission to execute again or as universal correctness."},{"id":"self-reported-evidence","severity":"material","message":"The runtime must not accept an operation-supplied success assertion or sensitive payload as evidence."}],"id":"sha256:4833634b41f011f43d7d0f987ac2e53584fe626f43b17ce33d32b5007c3d5038"}],"program":{"schema":"aria.intent-program-summary/0.9","artifactId":"sha256:157e6b82d8bbf50e4930a758a7186db388f82850b6b6eb5a5b4b3b70d8febf95","requestedEffects":["console.emit"],"outcomes":[{"id":"ambiguity.resolved","actual":true},{"id":"authority.ceiling.declared","actual":true},{"id":"evidence.observational","actual":true},{"id":"scope.locked","actual":true}],"observedForbiddenOutcomes":[],"id":"sha256:4b7932ca394a017707dbd86bbb625413eb839b9ed3db48290e08a62f20960c9a"},"evidence":[{"schema":"aria.intent-evidence/0.9","criterionId":"aria-plan-gate","kind":"aria-gate","subjectId":"sha256:157e6b82d8bbf50e4930a758a7186db388f82850b6b6eb5a5b4b3b70d8febf95","digest":"sha256:f1a66b88332336395b513302ad2e6d3f070d8217e14127b0054c2c0fadf504d1","passed":true,"id":"sha256:03f5ef005bf0a7476275d6b07e21b33c14fedc018741931f0eafa11e6760582b"},{"schema":"aria.intent-evidence/0.9","criterionId":"architecture-decision","kind":"design-record","subjectId":"sha256:157e6b82d8bbf50e4930a758a7186db388f82850b6b6eb5a5b4b3b70d8febf95","digest":"sha256:7276ced75f92c834dc34904abdab064809075fab235af5a07817ca92cde9aaad","passed":true,"id":"sha256:b385620d12bbe88110ab1a7bc5b6809a58f3cd993cde74ef01566a4f88c24643"},{"schema":"aria.intent-evidence/0.9","criterionId":"dedicated-evidence-lattice","kind":"test-lattice","subjectId":"sha256:157e6b82d8bbf50e4930a758a7186db388f82850b6b6eb5a5b4b3b70d8febf95","digest":"sha256:30a23adc31aa30e9556734392e7d1941f008221604fe44f53a08f26e053923be","passed":true,"id":"sha256:cff838c8da7fc962101cc3ee54ca3a01e94724693babbe2cf88cb484cef7f2a5"}],"verificationPolicy":{"schema":"aria.intent-verification-policy/0.9","trustedApprovers":["human:jackson"]}}
